0000001103;19.08.2024;;;;FULL_ACCOUNT;677,45;30233810642000600001 7707083893 ПАО СБЕРБАНК//Казадаев Дмитрий Викторович//1909559971229//127521, РОССИЯ, МОСКВА Г, Г МОСКВА, ПРОЕЗД МАРЬИНОЙ РОЩИ 17-Й, Д 1 КВ 103//;л/с 0000001103 за июль доплата 2024 г,19/08/2024
0000001015;19.08.2024;;;;FULL_ACCOUNT;7767,61;40817810000980637242 026608060092 Фаткуллин Айрат Сайфуллович;ЛС0000001015,Кварплата по ЛС: 0000001015,0724,пр-д Марьиной Рощи 17-й дом 1, кв. 15 НДС не облагается
0000003030;20.08.2024;;;;FULL_ACCOUNT;2205,76;40817810315010000002 0 ДАВЫДОВ ВЯЧЕСЛАВ ВЛАДИМИРОВИЧ//40817810300001228455//141006, РФ, МОСКОВСКАЯ ОБЛ., Г. МЫТИЩИ, УЛ. ИНДУСТРИАЛЬНАЯ, Д15, КОРП1, КВ6//;Перевод денежных средств Кварплата по ЛС: 0000003030 Давыдов Вячеслав Владимирович 0724  0000003030  пр-д Марьиной Рощи 17-й дом 1 (м.м), м/м А/м 30
0000003031;20.08.2024;;;;FULL_ACCOUNT;2205,76;40817810315010000002 0 ДАВЫДОВ ВЯЧЕСЛАВ ВЛАДИМИРОВИЧ//40817810300001228455//141006, РФ, МОСКОВСКАЯ ОБЛ., Г. МЫТИЩИ, УЛ. ИНДУСТРИАЛЬНАЯ, Д15, КОРП1, КВ6//;Перевод денежных средств Кварплата по ЛС: 0000003031 Давыдов Вячеслав Владимирович 0724  0000003031  пр-д Марьиной Рощи 17-й дом 1 (м.м), м/м А/м 31
0000003025;20.08.2024;;;;FULL_ACCOUNT;2386,56;40817810315010000002 0 ДАВЫДОВ ВЯЧЕСЛАВ ВЛАДИМИРОВИЧ//40817810300001228455//141006, РФ, МОСКОВСКАЯ ОБЛ., Г. МЫТИЩИ, УЛ. ИНДУСТРИАЛЬНАЯ, Д15, КОРП1, КВ6//;Перевод денежных средств Кварплата по ЛС: 0000003025 Давыдов Вячеслав Владимирович 0724  0000003025  пр-д Марьиной Рощи 17-й дом 1 (м.м), м/м А/м 25
0000003042;20.08.2024;;;;FULL_ACCOUNT;2693,93;40817810840004567985 0 Оболёшев Сергей Леонидович;Кварплата по ЛС: 0000003042,Оболёшев Сергей Леонидович (кв.91),пр-д Марьиной Рощи 17-й дом 1 (м.м), м/м А/м 42
0000001072;20.08.2024;;;;NAME_FLAT;13037,0;30233810800009992233 0 ПАО "МТС-БАНК" // КОЛЬЦОВ ЮРИЙ ИГОРЕВИЧ;комунальные услуги 17й проезд марьиной рощи дом 1
0000001019;23.08.2024;;;;FULL_ACCOUNT;8751,03;30232810110000000034 4401116480 КАМЕНДРОВСКАЯ ЮЛИЯ СЕРГЕЕВНА//127521 МОСКВА    ПРОЕЗД 17-Й МАРЬИНОЙ РОЩИ д 1  кв 19//40817810650151647923//;ПР-Д МАРЬИНОЙ РОЩИ 17-Й ДОМ 1, КВ. 19/КВАРПЛАТА ПО ЛС: 0000001019/БЕЗ НДС/КВ-Я 53201397850/СИСТЕМА"ГОРОД" FSG.RU//262978018//1
0000001050;23.08.2024;;;;FULL_ACCOUNT;10000,0;40817810101006428385 370261478429 Мустафаева Анастасия Николаевна //153000, Ивановская обл, Иваново г, Багаева ул, д. 25/1, кв. 78//;ЕЛС0000001050,06.2024//Оплата услуг
